,Unnamed: 0,reviews,polarity,tags
754,754,kyo london looking forward flight club world ticket first time flying boeing 787 good check experience breezed airport enjoyed jal lounge narita boarded time first impressions boeing 787 good modern plane nice mood lighting boarded food wines really good beautifully presented japanese starter followed bento style lunch final reminder holiday wife chose western options plenty choice ife big screen downside cabin hot made difficult sleep flight problem encountered outbound journey seat comfortable reclined fully find layout ba club world little awkward step another passenger footrest access aisle cabin crew efficient seemed bit exhausted could friendly welcoming context review spoiled flew first class way tokyo amazing experience comfortable seats exemplary service cabin crew felt bit disappointed return flight comparison felt room improvement time expectations might high previous flight,0.17618589743589744,Positive
755,755,london tokyo haneda wife treated first class flights holiday japan help avios ba amex companion voucher excited flying first class dedicated check area heathrow great boarded time cabin disappoint grand seats lovely surroundings cabin staff looked us fantastic really took time get know us understand wanted food alcoholic drinks great went beef main course followed amazing chocolate toffee pudding ready sleep food saw lots choice large screen ife wife said afterwards feel like long haul flight time passed quickly comfortably complaint cabin uncomfortably hot cruising made harder sleep,0.26699735449735457,Positive
756,756,flying london billund today via british airways bit hesitant never flown airline due early morning traffic running little behind schedule 23kg bag also check check closed 45 mins flight departs upon arrival greeted young gentlemen helpful respectful calmed reassured everything going okay stressed thinking going miss flight offered give fast track security could get gate quicker want thank made experience british airways like grateful,0.0534090909090909,Positive
757,757,san diego frankfurt via london started trying check online 24h departure san diego heathrow long flights like always reserve aisle seat online check work reason given ok let call us hotline tried least 40 times answers either call could completed check number due heavy call volume could process call right make act desperation today called british number lady told guess aisle seats available numbers tried available weekdays good know need help sunday got strong feeling even care customers b flight san diego 5 days ago tv screen gone way change seats great overall experience,0.21877289377289377,Positive
758,758,flown british airways numerous occasions issues however occasion baggage lost arrival gatwick british airways representative baggage claim however phone allowed call baggage department reclaiming lost baggage simple bag put next flight singapore received following day,0.0,Neutral
759,759,flying last sunday geneva piladelphia via london business class arrived boarding gate london take flight philadelphia told sufficient business seat available overbooked choice either fly ecenomy take next flight care customer phone call email indication lounge nothing boarding gate kindly accepted take next flight plane delayed 1 hour due technical issues arrived philadelphia suitcase british airways desk arrival late one could help finally retrieve suitcase 3 days later broken 3 days impossible get someone phone flight back geneva issue sufficient business class seats available clear company care customers care money,0.04754901960784315,Positive
760,760,london heathrow paris cdg quick easy flight paris took 40 minutes reach cdg everything went well cabin clean complaint boarding way long unorganized,0.15666666666666665,Positive
761,761,johannesburg london johannesburg used ba galleries lounge fine little busy plane boarded time hot due lack auxiliary power unit given aircraft jnb day perhaps could addressed take crew dispensed pre dinner drinks went straight meal portions starter small given someone else mistake taken away given thought originally idea new club world meal involved trolley service sign main good beef dessert cheese small basic selection bed gap seat made lie flat less comfortable breakfast ok delay baggage due another aircraft technical issue seemed arrivals lounge good overall average experience,0.12116046831955923,Positive
762,762,edinburgh bangalore via heathrow rude staff poor service missing baggage poor entertainment system spilled drink attitude staff brutal apologised clumsiness made feel like deliberately done shameful act public staff would want anything asked tissues answer get toilet staff even courtesy ask needed another drink cleaned crew also extremely noisy chatting laughing loudly pantry place entire duration boarding edinburgh offered check second bag free cabin full staff wrote bangalore via heathrow bag loaded connecting flight 4 hours gap mind,-0.11410256410256407,Negative
763,763,berlin johannesburg via london short haul flight berlin london okay include drinks snacks anymore short distance flights prices onboard compared low cost carriers high engine problem flights lhr jnb delayed 2 45h british airways gave 5 vouchers compensate snacks drinks inside a380 ife boxes window seats take big part available leg space,0.1325,Positive
764,764,w york jfk london heathrow british airways extremely average flight nothing stood good nothing stood bad flight smooth felt quite short cabin crew helpful everything comfortable inflight entertainment needed work,0.09285714285714287,Positive
765,765,always favoured british airways always try choose fly mostly decided flight times business travel always found better value cheaper airlines via additonal benefits like early check flight catering economy however ba stripped perks struggle see value put offering almost beside likes easyjet yet pay almost double today flew back denmark sas amazing made ba look cheap get good meal board get free drink charge electronics get wifi 2 9 euros outstanding,0.375,Positive
766,766,w york london via geneva british airways plane late issue flight attendants really friendly manner seemed rush finish service chill loudly 7 hour flight served us food 40mins departure 20mins started clearing even close finish eating 5 mins another staff member came took food didnt even time tell really poor service especially realise aircraft half booked actually rushing us able stop serving take nap comfortably raws empty seats next us thats call bad customer service ps charged 100 luggage buying ticket 350,-0.022435897435897426,Negative
767,767,a380 boarding always nightmare complicated occasion multiple pax wheelchairs delayed show pilots fortunately still managed take less time cabin crew responsible side first cabin personable lacked experience food served dinner mixture good mediocre warm salmon ice cold salad never pleasant experience seats first reasonably comfortable although lack privacy competitors premium cabin duvet made redundant typically overheated cabin one first toilets action make use club world loos upstairs would helpful cabin crew apologised inconvenience lack convenience comment made ife passable sound quality good one noise cancelling headphones used wifi available make use breakfast unremarkable wish bread rather pastries offered deplaning delayed half hour early morning congestion t5 lack stand overall reasonable flight first class,0.10133333333333333,Positive
768,768,2 3 2 seating front section club world upper deck feels marginally less cramped 2 4 2 showing age contrast carriers full cabin also means queues two loos although lot spacious first drinks dinner service took good couple hours revamped club world food definitely improvement fish option main course best food air white company bedding little cushion rather hard seats cabin crew generally good csm particularly visible flight breakfast improved option pre select items arrival ahead schedule,0.2067307692307692,Positive
769,769,london johannesburg smooth check via club world desks fast track security fast got lounge quickly lounge ok food little better staff seemed attentive able use spa nice showers fine queues flight left time first experience new club world catering seemed go well slept 5 hours lie flat newer aircraft better older 777 son says gap stool seat sometimes crew sector good fa serving area experienced showed csd seemed go motions arrival fine baggage first belt good flight,0.3525998622589532,Positive
770,770,ba836 19 jan excellent short flight heathrow dublin club europe cabin crew warm efficient overall service excellent club europe catering excellent pre ordered gluten free meal one standard passenger meals gluten free bread main course beef ratatouille co dessert pot best inflight meal short haul flight arrival dublin ground service swissport poor took time steps meet aircraft even longer 25 minutes ground staff open door allow arriving passengers terminal,0.36904761904761907,Positive
771,771,whatever happened world favourite airline returning bermuda gatwick presented worn boeing 777 seat table broken bits seat plastic hanging try balance seat tray knees dinner tray could kept flat work tray ended floor drinks food reported steward clearly upset complaint told put book apology attempt explain irritation food awful neither wife could finish also seemed incomplete cheese biscuits nothing go salad wife entertainment screen work passenger next screen work mine worked intermittently look liked something arc grid allowing touch sensitivity clearly visible believe 777s gatwick updated come moment soon purchased premium economy tickets flight get premium service initially going buy business tickets price ridiculous glad frustration ba grows every year fly,0.0034722222222222285,Positive
772,772,kuala lumpur miami via london business class british airways business class seats small business class pretty old flight entertainment system outdated sure selection could better crew selection food choices limited mine par business class overall ba better top game planes changed,0.10238095238095239,Positive
773,773,zurich heathrow last year started boarding flights groups week two free beverages snack service disappeared final nail coffin pay choose seating decided ba anymore moved away ba issue maintain frequent flyer status two three separate airlines last flight took ba use avios points literally flew free never use ba,0.15,Positive
774,774,miami london breakfast served landing terrible terrible croissant cream cheese onions breakfast fruit bar wrapped cellophane hardly anyone ate waste,-0.6229166666666667,Negative
775,775,copenhagen amsterdam via london heathrow british airways problems check lot people run make flight attitude welcoming hospitality crew made forget enjoyed flight seats nice comfortable aircraft fresh second flight lhr ams expectations first flight fulfilled captain knew passengers frequent fliers made jokes frequent fliers would understand like taxi polderban almost long flight,0.22000000000000003,Positive
776,776,antigua gatwick apparently necessary pay extra get decent seat priority booking despite paid full cost world traveler plus checked soon online check available find 4 seats 4 us remained unbooked take 2 seats front row seats seat storage narrow economy seats 2 back row constantly bothered adjacent toilets 1 loo side economy economy plus meant always queues people leaning us cabin pressure uncomfortably low overnight temperature stifling hot people got sleep breakfast hard cold half sandwich hurried cup tea coffee impossible get drinks refreshments service rounds tatty seat covers broken foot rest malfunctioning entertainment broken tables requiring us hold food drink knees asked help stewardess told us screw driver fix things old plane lots type issue,-0.08578431372549021,Negative
777,777,understand completely air rage skies companies boac go way make travel experience stressful unpleasant humanly possible paid 813 fly r lax buh yet want extra 150 desirable seat understand check 24 hours departure receive seat available assign worst seat available betters case assigned middle seat 787 adjacent aisle seats available assign baffling ground crew inflight staff excellent little oppressive business decisions executives make everything comes make every penny flying boac owed 25 last flight b c inflight entertainment system inop 1 2 cabin sit dark nothing twelve hour flight top seats little padding cushion plumpest sit seats longer 15 normal sized adults agonising rack must course get compensation patronising know ever free ticket boac overpriced,0.10972222222222222,Positive
778,778,london miami worst long haul business class annoying divider ridiculous fold footstool worn seats service non existent unless serving meal want snack drink get seat hunt cabin member ask need anything meals toilets dirty basic gold member giving fly updated airlines crammed many business class seats possible expense comfort like cheap,-0.10833333333333335,Negative
779,779,used avios point upgrade economy premium economy get wider seat inches leg room boarding straight forward premium cabin plenty overhead locker space water juice served takeoff champagne staff well turned rushed premium cabin served economy cabin crew hot meal served hour take good piece beef stewed vegetables chocolate mousse biscuits cheese quality red white wine served inflight movie selection ok light snack biscuits crisps served landing along coffee tea getting planes slowed immigration staff coming onto plane inspect passports best flight,0.38125,Positive
780,780,boarding fairly quick well turned staff quickly got people board bags stored lucky one sitting next room pre take drink water orange juice within hour take hot meal beef salad served good dessert wine selection american jug wines movie selection ok pe seats comfortable economy extra 4 inches width make huge difference 2nd meal flight snack crisps cookies,0.2708333333333333,Positive
781,781,bangalore london ground experience great lhr automated bag drop work clear slow react assistance eventually came identified travel visa india needed validated blr online check available slow process plane decor extremely run shabby various pieces interior trim bulkheads etc rattling latches bassinet shelves locking row 12 bulkhead seat legroom excellent however comes hassle able leave anything floor takeoff landing stowage racks never big enough hold blanket pillow provided seat could width kept bumping vod control quite slim recline limited footrest could extend usb power seat seems crazy day age vod atrocious tiny screen folding armrest bulkhead seats low resolution visible gridlines little choice hardly latest movies top outbound leg vod stopped working altogether resisted many resets customer service forms handed await outcome food volume ok quality poor scrambled eggs breakfast smelled terrible plenty drinks outbound leg inbound cabin staff seemed indifferent inbound leg insufficient lavatories premium economy economy,0.04852484472049689,Positive
782,782,barcelona new york via london barcelona four days one small bag asked check flight barcelona london delayed causing passengers miss connections finally got flight taxied hour told needed return gate luggage loaded incorrectly took nearly 24 hours travel barcelona jfk arrived luggage filed claim called emailed every day find even though tag number documentation eight days later finally contacted gave six hour window bag delivery final insult expected file claim missing personal property within seven days result offered compensation damages,-0.031363636363636364,Negative
783,783,gatwick fort lauderdale charging choose seats even within 24h prior take outrageous someone decides carry hand luggage one choose seat without paying extra charges,-0.3333333333333333,Negative
784,784,recently flew london bologna aircraft full requested people place cabin bags hold checked luggage save space arrived carry bag accompanied many flights past 3 years damaged beyond repair use journeys approached damaged lost baggage area lodged claim provided evidence explained continuing travel needed replace bag asap advised representatives ring ba service line made call spoke replacing bag reasonable submitted claim well still going despite replacing bag cheaper version total cost refunded instead asked produce receipts 3 years ago offered half money due depreciation despite good flight etc ongoing angst money refused refund,0.13425925925925927,Positive
785,785,venice london city really great experience british airways enjoyed much flying british airways lovely staff great service,0.39999999999999997,Positive
786,786,san francisco london terrible service food cramped uncomfortable seats terrible entertainment one flights working crew care less fly,-0.3733333333333333,Negative
787,787,heathrow vancouver seats booked given took 3 months respond complaint submitting multiple messages update dirty plane fantastic front line staff would never fly ba,-0.18,Negative
788,788,london bucharest first class ground staff air quite disappointment basic economy seats little cushion agony sit longer 15 1 95 coca cola,-0.134375,Negative
789,789,forgot purchased hand baggage fare airport charged 60 euros bag came almost much fare cost staff check could less helpful whole experience bad low cost airline boarding process saw category 5 board last much glass water offered seats little legroom one toilet a319 economy cabin,-0.05416666666666664,Negative
790,790,passenger front reclines seat makes difficult get one seat arm rests go way middle window seat passengers climb little leg room leg rest boeing 777 ife screen smaller ones british airway 747 400s could upgrade saving grace flight excellent service dedicated professional flight crew,0.05892857142857143,Positive
791,791,boston london world traveler seats nice headrest legroom okay overall cramped especially passenger front reclines seat seat back almost lap making impossible read british airways magazine even use ipad ordered special meals halal low sodium muslim meal chicken tikka masala naan restaurant quality flavorful spicy hot gulab jamun dessert also restaurant quality like mom low sodium meal herb roasted chicken tomato rice petite broccoli diced red pepper carrots delicious dessert consisted fresh blueberries blackberries ife good bright clear led screens good selection entertainment movies several languages,0.1590702947845805,Positive
792,792,london athens fortunate get exit row seats advance spacious plenty legroom width cramped boeing 747 400 flown carry however transit process british airways ground staff made us check one carry bags idea criteria used select passengers check carry bags bare bones service meals okay complimentary soft drinks water bottled water available purchase hindsight would better flying aegean airlines,0.28125,Positive
793,793,london johannesburg impressed lady checked us something went wrong booking supposed fly 18 10 boyfriend back home south africa visit uk somehow ticket booked 21 10 even notice brought check shocked fact would traveling first trip overseas willing help fixed within matter 1 minute obviously thought would able sit next grateful hearts checking bags gave us boarding passes mentioned best seats aircraft awesome thank british airways helpful staff,0.2642857142857143,Positive
794,794,wark bangalore return via london ba premium economy world traveler plus paid 40 premium economy 600 extra approximately 150 per leg worth say broadly yes though want pay much would harder justify one leg 6 7 hours involved boarding premium economy get standard 2 checked bag allowance whereas economy 1 bag though numerous exceptions allow 2 india us canada one exceptions though clear applies travel originating either end sure got extra bag use 2 bag allowance boarding board zone 3 first business oneworld elites helpful get dibs overhead storage fit premium economy always put front behind economy begins boarding means also get fairly quickly help hurry get security heathrow connecting flight immigration final destination flight welcome drink premium economy champagne juice water depending departure time also hot towel service also 787 cabin 787 9 nicely done premium economy cabin 2 3 2 seating opposed 3 3 3 economy somewhat wider seat seat pitch also decent new style slimmer seats though possibly less cushioned get older seats seat comfortable food tray comes armrest seat back storage though much small drinks tray built front arm rest share neighbor recliner style footrest support calf get noise canceling headset nice basic amenities kit eyeshades socks toothpaste seat back screen large easy use restroom cabin one immediately behind economy long walk 777 cabin 777 2 4 2 seating premium economy club world opposed 3 3 3 economy 777 version used lhr blr sector small premium economy cabin 3 rows seats gives sort cosy feel walk way economy section immediately behind get restroom economy looked pretty full legs 777 premium economy full seat next vacant legs helped stretch sure seat back screen old 777 much smaller seats older possibly cushioned slimmer 787 seats food nothing much think different regular economy meal would ok nothing write home long journey premium economy product offer additional comfort along early boarding baggage worth extra long haul like us india bit harder justify shorter flights fewer legs,0.11114817001180637,Positive
795,795,london berlin scheduled 21st december approach airport got message saying flight canceled explanation given arrived airport staff acted confused said rerouting center closed evening due issues wanted travel next days ahead christmas book travel another airline train company e g eurostar costs would reimbursed airport staff also said help british airways available day due airport issues felt way rebook different airline hefty 300 gbp fare short haul flight next day christmas prices high arrived destination lengthy exchange messages british airways started british airways said end compensate costs rerouting different airline opposite airport staff said day cancellation,-0.01705882352941176,Negative
796,796,london mumbai battles leadership ba would let book seat pay airmiles finally relented please many earn airmiles credit cards illustrate boarded ba199 slightly negative mindset mindset changed quickly although travelled economy seat comfortable service excellent food minor quibble choice films seems reduced many quite old ba attempt reduce costs quite obvious detracts overall quality product particularly impressed trouble cabin staff took warn us take single use plastic e g water bottles duty free carrier bags terminal could result stiff fine grumpy several aspects ba service past writing leadership thank improvements,0.18759398496240598,Positive
797,797,athens los angeles via london worst flight experience ticket october travelling 1st december 24hrs decide cancel flight give alternative another flight 3 hrs later athens los angeles via london day arrive london realize announcement screen flight operated heard announcement last call departure checked ba information desk confirm flight one cancelled asked reply found aircraft 12 hrs rescheduled flight send email response twice flight never operated rescheduled think overbooked flight didnt care,-0.3333333333333333,Negative
798,798,return journey sydney london approximately 22 hours duration stop singapore airport faced one major issue flew economy class two year old whose inflight entertainment headphone socket working paid 723 two year olds ticket would except inflight entertainment working long flight complained cabin crew best unfortunately socket could fixed offered move seats 2 seats available however three us practical cabin crew gave us first class goodies including bottle champagne inconvenience caused also said could offer us monitory terms 25 said would contact ba customer services behalf complain expect compensation crew could offer us time got plane baggage claim already received email ba c would respond within 48 hours however could offered 20 voucher use another ba flight replied declining said insult originally paid flight explained cabin crew said also said intention booking foreseeable flights airline therefore evoucher worthless alternative means reasoning flight basic seats uncomfortable ba also offer wifi plane try use charge 4 99 per hour economy class,-0.018749999999999996,Negative
799,799,flown british airways leeds bradford london heathrow part journey back home thailand 12th december 2018 arrived leeds bradford 3 hours early queue check counter check process took less minute already done online check means dropped luggage staff airport friendly helpful passed security control waited aircraft boarding process mess priority boarding flew economy boarding groups luckily every passenger could board front rear door aircraft parked remote stand aircraft old cabin modern clean seat comfortable good wing view downside seat second last row back seat pitch short luckily 176m tall problem aircraft delayed due slow boarding process weather condition crew friendly helpful captain always announce information whole flight let passenger know cause delay flight information flight departed crew started board service buy anything food option poor expensive paid credit cards one hour flight expect top service standard flight arrived london heathrow time despite traffic overall flight service crew made flights enjoyable improve food boarding process better,0.11091954022988508,Positive
