,Unnamed: 0,reviews,polarity,tags
459,459,london singapore apprehensive flying ba club world reading many negative reviews however surprised firstly part sq qr fair found one reasonably priced offerings get pay seat old perfectly comfortable plenty space window seats best privacy tall issues sleeping fact slept almost 7 hours service food london top notch fresh plentiful welcome contrast tiny meals receive qantas service consistent polite attentive drinks water continually topped truly impressed return flight service average quite sloppy let focus positives,0.31296296296296294,Positive
460,460,ulouse london able bodied fit ba customer silver member seated emergency exit seat put away items fastened seatbelt full compliance regultions cabin crew member came row point security exit safety card listening responding despite ordered take cabin pressure equalizers called earplugs explained needed keep protect ears doors already closed suffer ear problems fly told could hear perfectly demonstrated vocal exchange despite kept talking threatened remove seat fail follow order begrudgingly took ordered removed seat pointed already asked speak purser came see take told cabin crew member unnecessarily rude needed customer care training indeed look new job wrote british airways complaint even bothered respond awful rude airline,0.052797202797202805,Positive
461,461,london heathrow stockholm business class short haul seats economy one sitting middle seat get served drinks food proper gin g good food,0.175,Positive
462,462,johannesburg london limited recline seats 11 hour overnight flight checked asked told good seats completed complaint asked ba thought ok come representatives allowed lie never flying ba,0.20714285714285713,Positive
463,463,johannesburg london recently refurbished first club world lounge jnb failed resolve congestion passengers two evening flights lhr descend table space eating food improved poor acoustics mean intrusion privacy crying babies facetime calls add restless maelstrom human activity boarding reasonably quick although usual confusion group queues predominantly young mixed fleet crew competent lacked finesse kept getting drinks orders muddled meal service took ages unidentified problem heating main course food bad finally served cabin temperature hot slept quite well arrival ten minutes ahead schedule baggage collection quick overall good flight despite aged club world product,0.008134920634920623,Positive
464,464,london heathrow miami flying boeing 747 400 unfortunately ba done much work first class aircraft seats flat bed wedge front even 6 1 makes beds small since narrow feet get clamped sleep side seats business class example qatar airways still think first class ticket include wifi always service excel crew friendly helpful meals impeccable,0.09444444444444446,Positive
465,465,stockholm london heathrow always ba works excellent service ground air still good gin aboard decent g even meals business looks like came 90 economy taste great,0.6666666666666667,Positive
466,466,london sydney via singapore flight left time cabin crew fantastic meals great leaving london chicken stir fry landing singapore 18 00 served english breakfast eat time day wife thought bit odd singapore passengers disembark aircraft refuelled clean boarding go security check gate ground singapore 1hour 30min 2nd leg sydney great also food drink service great 23 hours long haul flight comfortable exit row seating entire flight recommend anyone 6ft tall,0.21153846153846156,Positive
467,467,london new york jfk booked brussels airlines two us cancelled flight rerouted us ba flight bru london fine transatlantic leg heathrow airport terminal 5 utter nightmares never go heathrow however review ba 747 400 jfk aircraft sorry state junked years ago ba gall call service business class seats tiny wrapped plastic chicken coop partitions rattled even fell several occasions let add faced backwards looked filthy wall cabin service friendly food actually quite decent aside understand ba horrendous well deserved reputation never,-0.0732093663911846,Negative
468,468,first thing shortage staff business cabin quite large eight across seem serviced one two people side meant drink takeoff appear hour order taken unfortunately although pleasant staff mark appeared undertrained asked young man turn reading light claimed showed one seat fiddling said must broken end flight discovered switch despite newly configured plane dividing screen kept dropping ask cup tea 3 times choice two reds two white wines considering number people business section understand would offer third port menu never offered cheese every time next course came setting ready accept due plates glasses previous course many people clutter uncleared hour end meal courses quite small portions end meal ready mini snack big eater peckish layout business cabin cramped 6 could stretch seats legroom extremely narrow people centre two rows window seats climb passengers means one easy seat either climb climbed wonder expect bad design accepted business market travel many airlines business ba still bottom pile reluctantly last one would use centre window seats food drinks served effectively service hatch across customers unfortunately upon arrival bridgetown ba team get better one hour 25 minutes waiting fast tracked luggage approached guy wearing ba tabard shrugged shoulders found another guy worked ground staff went outside found 25 cases sitting tarmac nothing,0.07591604823747682,Positive
469,469,brussels bangkok via london club world london bangkok 17 nov 2019 seats 15c 15d boeing 777 2 4 2 seat configuration business cabin gives cabin crowded impression seats comfortable flat bed mattress good selection entertainment although rather small screen food menu offers different choices starters main course desserts food disappointing smoked salmon starter british beef main course soup cold mybeef overcooked quantity economy class like service friendly personal used adressed name fly business class serving meals forget serving wine amount cabin crew enough crowded business class cabin dinner went sleep seat turned real bed extra mattress good pillow space narrow difficult make bed bed made place put personal stuff real good night sleep though seat aisle step someones legs go toilet toilets small simple cleaned frequently enough woke breakfast service running breakfast good yoghurt pastries fresh fruit full english breakfast overall british airways world club rather standard business class lacks personalized attention lacks feel good experience ba wants compete long way go hope make bit return flight,0.12083333333333335,Positive
470,470,san francisco oslo via london head support damaged sit 10 hours leaned forward flight san francisco delayed missed connecting flight london oslo came first ba counter received new flight 3 hours 15 minutes later rude staff gave voucher 15 gbp,0.02159090909090909,Positive
471,471,connection flight london berlin traveling hand luggage got automatic boarding gate man gate said need check baggage right grab passport boarding pass flight full check overhead lockers arent things put seats fits hand luggage flight arrived berlin 7 minutes late,0.1119047619047619,Positive
472,472,london johannesburg british airways ba b gates lounge rather civilised place pass time galleries lounges main terminal also tad closer transit via rather useful walkway level 4 c gates a380s depart new boarding groups meant snaking queues least group 2 moved fairly speedily club world still much maligned seats small unresponsive ife screens limited selection films dinner service slow unwise introduction individual trays brought seat trolleys may lack glamour one get sleep quicker overnight flight breakfast adequate nothing landing exactly time overall reasonable flight inflight service distinctly average,0.07593344155844155,Positive
473,473,london bangalore flight bangalore london 10 november 2019 delayed 4 hours resulted missing connection flight return london bangalore initially delayed 1 5 hrs assigned boarding gate waiting gate 30 mins announcement made flight delayed 4hrs 27mins due maintenance,-0.10833333333333334,Negative
474,474,london sydney via singapore would like express thanks appreciation staff bag drop centre heathrow lost passport thursday evening 21st november spent nearly 2 hours trying locate eventually found 30 mins flight due leave big thank would also like thank cabin crew flight ba0015 singapore sydney 22 november kind taken ill flight looked well,0.021875000000000006,Positive
475,475,lisbon london pay extra check bag ensure using share overhead space british airways charge 50 euros check bag final destination insist briefcase put seat cramped aircraft ensure room overhead bin travelers cheap check bags insult never fly ba,0.0,Neutral
476,476,ba operate daily shuttles london glasgow busy route sure make money plus competition however ba flights rarely time fee paying passenger fed stories aircraft delayed en route far flung exotic location several buses trains catch reach glasgow punctuality means lot lot ba hence disappointed service provide,0.09375,Positive
477,477,doha london surprisingly good flight ontime departure early arrival 30min attentive friendly crew especially towards children food halal since doha clearly announced passengers bag arrival ok seat leg room entertainment beyond expectation,0.31071428571428567,Positive
478,478,london buenos aires paid extra top holiday cost fly direct flight firstly cancelled flight months departure meaning go day earlier pay extra night hotel plane old cramped making difficult get walk around 14 hour flight entertainment system pathetic much film choice random selection tv programmes games drinks service lacking food awful snacks offered long haul flights comfort packs toothbrush toothpaste etc offerings,-0.07857142857142856,Negative
479,479,san francisco london a380 wonderful aeroplane movie selection average staff polite fist time used call button mid flight response fast second occasion repeatedly ignored call button 45 minutes see acceptable,0.21000000000000002,Positive
480,480,sydney singapore british airways packed like sardines tin disappointment airline pack even getting seat debacle due cramped nature flight configuration awkwardly stare fellow guests sit right opposite trying lock gaze seat close aisle times felt like people walking get past narrow passage ways would could recommended airline seats best premium economy,-0.054365079365079345,Negative
481,481,london mauritius fortunate enough flown many different airlines including low cost carriers also upper class cabins premium airlines without shadow doubt whole british airways experience poorest aeroplanes seats general service experience importantly poor customer service following bad flight truly feel airline deserves go bust truly disgraceful approach service product deliver begrudge flying given option always choose different airline,0.0038461538461538668,Positive
482,482,los angeles amsterdam via london due delayed take risked missing connecting flight thanks excellent premium host service julie colleague managed time thank much,0.215,Positive
483,483,london vancouver used fly aircraft route many years longer priced competitively flew 14th remarkably bad experience food service poor aspects chicken tandoori far spicy palettes drink offered meal astonishing rather tea coffee obviously far cheaper offering supplied soon dinner tray handed ask twice beer delivered put sync service one time yes one time offer tea coffee obviously missed completely service good warmth hospitality 9hr flight engagement pretty critical hostess host seemed interested sitting extra legroom seats essentially ignored everyone else cold snack cold tasteless sandwich prior landing entertainment system joke old become accustomed normal newish tv screen blown away system still place screen size equivalent phone music selection worth talking used ipad similar routes flown air canada westjet virgin atlantic air transat ba far worst airlines budget nature offer paid meals believe mighty ba offers terrible product 2019 spend fly better actively avoid ba long haul,0.0020202020202020267,Positive
484,484,flight departure delayed due captain described announcement mix paperwork disembarkation delayed due also described mix landing bridge allocation plane taxi around runway gate found missed connecting flight staff purple airport supposed help passengers find connecting flights know ended shunted onto another flight resulting four hour delay inconvenience due ba incompetent management seat would recline food carbohydrate filigree flight attendants rude used good airline,-0.05416666666666666,Negative
485,485,london heathrow lisbon mediocre flight smooth arrived time cabin service left great deal desired staff seemed going motions bread roll offered meal service despite requesting glass wine accompany meal forthcoming staff required nudge delivered great club europe experience,0.3,Positive
486,486,london boston comfortable flight economy class food fairly good ways dinner evening flight west returning night flight east got solid sleep flight back,0.275,Positive
487,487,ana london gatwick fly british airways around six times month thanks work almost always pleasant experience past flight definitely outdid others boarded departed exactly time friendly welcoming crew flight fully booked travel companion lucky one sitting row could empty middle seat therefore space best surprise flight far availability wi fi never british airways flight within europe fact wi fi package got included texting unlimited incredibly fast good home connection truly made flight enjoyable allowed continue business even flight extremely valuable something british airways improve would leg space flight noticed particularly tight although common problem 1 88 cm tall also unknown reasons food snacks served 2 hours 45 minute flight drinks slight struggle skipped breakfast managed well flight however arrived ahead schedule de boarded quickly always recommend ba continue,0.1793650793650794,Positive
488,488,gatwick st lucia great service flight thank much cabin great cabin crew excellent service,0.7,Positive
489,489,london singapore commend ba staff occasion friendly welcoming accommodating passengers throughout flight even last moments laughing joking us highly professional sensitive needs despite tiredness thank ba making long journey tolerable one,0.10499999999999998,Positive
490,490,london san francisco return economy seats small outbound bearable empty seat two us returning empty seat horrible 5 5 female lean seat front collect belongings want get anything bag seat front need major maneuvering touching person next throughout flight unavoidable flew 747 ways longer air vents adjust flights got stuffy warm ask turn c ways literally sweating economy small aircraft mostly made business class asian vegetarian meal good usual although breakfast terrible asian vegetarian breakfast economy plus much better find alternative airline long haul flights worth,0.008552631578947367,Positive
491,491,gatwick venice flown route class two occasions pleased aspects recent trip mobility issues check operator immediately suggested assistance service welcome efficient particularly gate distant one flight departed time cabin staff pleasant food good flight information flight deck good landings noticeably smooth return journey similarly good satisfied,0.4636363636363636,Positive
492,492,bordeaux gatwick british airways cancelled september 11 flight due pilots strike advance notice made alternative travel arrangements confirmed wanted cancel end order receive refund received confirmation ba 24 august 2019 ba refunded fare soon enough still awaiting refund 70 euro cost baggage paid six weeks later lodged complaint 9th october action lodged another complaint 25th october still action cancelled flight refund money call customer service,-0.013888888888888883,Negative
493,493,seychelles london day time flight back london staff welcoming greeted entry aircraft shown seats 7 j k best seats couple book away toilet front cabin window k seat direct access aisle time departure swift meal services nothing trouble flight full easy access club kitchen meal service great entertainment found flight great love inbound day time flight london easiest travel seat screens worked great problems loved every minute flight big thank staff fantastic looking forward next flight rio december,0.3766666666666667,Positive
494,494,london belfast british airways bullied parents spoilt special occasion booked parents ba attend investiture palace mother heart attack 3 months ago first flight post recovery chosen ba expecting best level service instead treated appallingly felt bullied airline staff mother suffers claustrophobia always requests aisle seat booked parents 2 aisle seats side side printed boarding passes seats 24c 24d arrival check one boarding passes recognised scanner assistance printed new one going security boarding pass recognised new pass printed parents arrived gate noticed one seats changed father explained situation rep check started quoting geneva convention ba contracted get b could change seats wanted waiting gate try resolve situation eventually 5 minutes airborne rushed aircraft forced sit apart care welfare circumstances stage receive apologetic words someone recovering heart attack unnecessary stressful event spoilt special family occasion holding hope bas slide grace halt seem constantly disappointed await bas response parents know fly carrier handing back ba amex points appropriate apology issued update summary trust ba loved ones care,0.11481331168831169,Positive
495,495,london cape town booked business class tickets year advance trip africa usually fly star alliance picked ba segment better connection timing london cape town huge mistake tried reserve seats ba website twice able tried call ba twice gave hold hour time call back option arrived today london toronto connections desk seven hours flight told business class oversold would downgraded premium economy ba representative told us reserved seats bottom list business class loyalty customers would priority seats us would still welcome lounge bonus problem us clear security get lounge since could print boarding passes due grade took close hour get settled lounge time first arrived connecting desk asked speak manager four interactions ba staff told would get speak us giving impression trying pass unhappy customers fast could one point got visibly frustrated ba staff issuing new boarding passes indicated grade voluntary definitely two half hours ba customer service managers came speak us first ones actually apologetic tried address situation customer oriented perspective british airways think giving bulkhead seats premium economy basic lounge access paying business class passengers adequate customer service downgrade paid business fare upcoming overnight flight booking flights ba,0.13390151515151516,Positive
496,496,san jose london tv screen 12f broken could locked position would allow watch movies flight attendants could fix suggested move different seat slipped purpose checked back seat front dirty tray 12d moved hole right side tv screen sensitive enough operated touch although husband 12e turned breakfast cards together flight attendant insisted planning wake serve breakfast flight attendants best seems understaffed,0.06507936507936507,Positive
497,497,london heathrow edinburgh boarding efficient flight full passengers asked volunteer check hand luggage would get priority boarding took offer laptop carried plane aircraft two months old sat back plane 36 f sure ryanair room british airways aircraft offering ultra low cost service cloak legacy carrier legitimacy,0.15833333333333333,Positive
498,498,flight gatwick barbados check business lounge good looks like added champagne self service drinks positive breakfast good flight left time boarding well run flown economy cabin seems ok new configuration come panasonic ife system way better old rockwell collins systems food fine service friendly,0.365530303030303,Positive
499,499,supposed flight bumped icelandair flight rebooked onto ba direct toronto london heathrow tried get changed supposed fly gatwick flight quite good service fantastic chicken tikka masala tasty crew onboard friendly flight time landing amazingly smooth,0.31071428571428567,Positive
500,500,travelling jeddah london bag arrive 1 hour 30 minutes earlier check counter closed tried best staff help leave bag allowed take bag plane london made complaint saying thing get customer service phone call takes 1 hour 47 minutes wait,0.15000000000000002,Positive
501,501,zurich london return legs travelled hand luggage could choose seat without paying fair enough 3 empty rows either side 3 strangers cramped one row allowed spread paid premium price seems mean say least hand luggage fares last board make uncomfortable board free food drink,-0.014062499999999992,Negative
502,502,san francisco london efficient check friendly agent offered upgrade first 760 per person declined refurbished lounge spacious comfortable nice selection snacks boarding time could better controlled flight left landed ahead schedule flight attendants excellent food vastly improved compared last trip business class cheap excellent flight complaints,0.4113636363636364,Positive
503,503,london belfast check fast efficient using ba terminal 5 first class check security area really good straight lounge great selection food drinks early morning really like ba boarding process e group numbers onboard service quality breakfast served excellent overall happy short flight ba,0.38636363636363635,Positive
504,504,london gatwick salzburg british airways worst customer experience ever cancelled flights due strike action response weeks getting answers told fault would pay towards cost changing flights back home,-0.205,Negative
505,505,frankfurt london flight attendants kind flying return flight canceled london city airport took almost three hours get rebooking hotel voucher transportation arranged could done far efficiently water nothing necessities,0.35,Positive
506,506,hyderabad san francisco via london awesome experience one customer service representatives british airways called regards reimbursement put across lady named florencia helped gather details bank address etc required payment also initiated payment instantly certainly beyond expected great job service exemplary,0.38285714285714284,Positive
507,507,ancouver london poor experience flight ba 2 4 2 business nice much crowded economical class one toilet closed nobody around repair one point ba even better asian companies even freezing need freeze 9 hours trip staff answer question staff make better one good point seat surprisingly comfortable easy make better,0.2769230769230769,Positive
508,508,london malaga terminally ill airline packed clueless staff full attitude checking gatwick airport told flight might well delayed 2h departed yet malaga sms confirmed delay without new time departure provided link flight status gatwick arrival departure boards prior security check flight time shown online asked ba guy lounge kiosk said could check link provided go security monitors surprisingly flight time text sent update gate told aircraft replaced apologies anyone neither ground flight boarded 5 pm took 18 15 stiff recliner seats cabin crew sociopathic full attitudes 6 additional seats replacing 2 toilets located back 320 located far end aircraft cabin crew storage room working space horrible low cost service flag carrier ticket price,0.026839826839826848,Positive
509,509,brussels london given seat number upon check left waiting outside gate boarding passes printed without explanation everyone else boarding pass boarding whilst 50 looking operators thinking going extremely poor communication airline airport operators,-0.13333333333333333,Negative
510,510,flight london singapore premium economy worst experienced seat uncomfortable flight tracker failed two hours breakfast prior arrival singapore scrambled egg like rubber ran cups wife coffee tea drink breakfast used call button get attention one came answer call even waiting 30 minutes eventually made contact passing cabin crew member advised drink told would come back never saw crew member,-0.19999999999999998,Negative
511,511,kuala lumpur glasgow via london service started first drinks aisle female attendant young male attendant asked ale attendant pretended understand asking repeated many times word ale spanish accent still catch male attendant said like ipa answered yes changed beer offered amstel heineken chose amstel ask ice make drinkable service finished female attendant collected empty bottles cans glasses skipped meal chose beef asked beer male attendant realized empty still took food drinks started eat ten minutes obvious beer coming stopped another attendant going business class came back option tiger heineken lager female attendant offered coffee mention normal coffee menu said decaf available specifically request abreakfast offered tea coffee even decaf accepted milk cream,0.11199999999999999,Positive
512,512,london heathrow seychelles really great flight boarding quick flight full seats great 07 b good inflight entertainment plenty choices food good already pre ordered meals beef well done like late 30 minute delay landed time seychelles crew attentive lots demanding passengers good flight 7 hours sleep,0.4981481481481482,Positive
