,Unnamed: 0,reviews,polarity,tags
226,226,british airways continues go downhill flew business class experience like economy 20 years ago except glass champagne packed full 3x3 seats issue day even seat pitch width economy gone little pretend tables middle seat give illusion style food dreadful flight service unsophisticated ba used acceptable european business class european airlines offer much better flight experience business class comparison ba taking premium frequent flyers granted treating us like mugs miss politeness old ba business class around 5 years ago used look forward small gestures like hanging coat giving hot towel nice food served galley rather manky trolley covid reason years cost cutting result dreadful,-0.07583333333333334,Negative
227,227,outstanding warm smiling welcome board flight excellent flight crew friendly attentive professional detailed announcements flight deck well food wine good indeed premium economy product ba also good comfortable seats foot leg rests decent recline fr superior airline atlantic routes,0.5262820512820514,Positive
228,228,british airways scrapped mandatory wearing face masks onboard flights although pretend publicly policy remains ba454 london malaga 25th february across 6 visible rows around 7 24 passengers wearing face masks one long meal drinks service cleared remained like landed deplaned cabin crew frequently aisles word said non compliant passengers left aircraft staff bidding farewell guess scared remind people follow rules,0.01,Positive
229,229,ba got wrong 6 hours delay food voucher 4 pounds information advice staff serve waiting passengers attitude towards passenger one dispensable commodity,-0.5,Negative
230,230,another episode unmitigated shambles comes customer service day storm eunice english half term holidays getting underway make allowances accept could delays fact compounded late cancellation raft flights domestic european destinations evening saturday 19 february operational reasons pitiful could rebook via ba website instead passengers compelled queue gate a17 lhr possibly rebook provided accommodation overnight ba cabin crew helpful customer services south lounge simply directed passengers ever growing queues a17 disgrace,-0.06666666666666667,Negative
231,231,check iad quick easy lounge washington ba lounge good sound pre flight food offerings overnight flight flight time boarded promptly eaten opted sleep full dinner breakfast service wanted slept well time arrival quickly made t5 arrivals lounge excellent,0.5071428571428572,Positive
232,232,old planes poor food minimal leg room economy check procedure online work fellow travellers special meal request given weeks advance food allergy ignored spoke ba customer service representative soon landed heathrow said could help referred telephone line said referred online complaints form trying weeks raise concern food allergies prevent happening others reply via complaints website twitter telephone hotline also currently unavailable,-0.008571428571428574,Negative
233,233,booked ba return flight one hour way club class paying 700 euro 2 persons asked pay 96 euro choose seats business full business class ticket fee seat disengaged management model,0.35,Positive
234,234,ba got everything right allowed evening check allowed lots time staff help paperwork needed travel us day travel half term airport busy spite security lounge 5 minutes lounge clean staff proactive food served quickly good range drinks easy transfer c gates aircraft ready boarding quick well organised pre departure drinks served cabin crew excellent provided good service food new club world menu options roast beef excellent although older club world product clean well maintained time arrival baggage fast overall excellent flight feels like ba improving offering time many providers use covid excuse service cut backs well done,0.3827409432672591,Positive
235,235,appalling customer service cancelled flights rebooked us confirmed change hotel reservation part inclusive booking hours hours telephone response get recorded message say take call respond emails sent complaints line,0.025000000000000022,Positive
236,236,past november december flew washington london return strength trip first two years inflight service quality appears pretty much returned pre pandemic status quo ante cabin clean well maintained seats comfortable food drinks good including tasty hertfordshire roast pork return leg ba cabin crews remain best business one number bookings book number times due flight cancellations contrary experience many bookings handled courteously thoroughly although number lengthy waits hold present circumstances expected good see everyday product held well amid dreadful time looking forward future trips ba,0.19362745098039216,Positive
237,237,best experience ever airline initial flight dubai canceled royal air maroc find new flight last minute found booking extremely simple unfortunately cancel flight day departure called customer service waited 20 minutes could speak someone within 15 minutes flight canceled offered full refund person line extremely nice understanding willing help us never dealt nice employee airline got full refund credit card day usually chose cheapest flight ticket regardless airline definitely make sure check british airways first,0.20539772727272726,Positive
238,238,ba cancelled original return flight rebooked us day later issue enjoyed extra days holiday others might flexible however overlooked rebooking connecting flight lhr fortunate still space flight checked atl aircraft newish excellent condition flight around 50 capacity service excellent staff friendly efficient dinner good breakfast disappointing little choice lhr bhd leg equally good beginning think ba getting mojo back,0.32788461538461533,Positive
239,239,boarding slow uncomfortable account lack air con gate club suite cabins 3 4 full rest plane much 20 occupancy whether reason cabin crew flight cut bare minimum hard say certainly work hard covering multiple cabins despite drink food service business efficient current policy serving courses meant dinner done dusted two hours take real bonus night time flight however quality food remains mediocre best pasta dish almost inedible club suite big improvement ancient cw product although storage funny arrangement tiny compartments invite losing smartphone two one definitely misses drawer foot level old cw large screen really improves viewing experience whole ife system much responsive new seats significantly aid sleeping particularly obvious ridge level base spine waking two hours touchdown definitely recommended order get breakfast avoid usual queues toilets performance flight deck usual high standard arrival twenty minutes ahead schedule progress border control speedy baggage collection delayed unspecified reasons overall good flight,0.04141217368490095,Positive
240,240,unfortunately flown new club world cabin time incredibly old plane good cabin crew tried make trip pleasant possible bad flight entertainment screens unwatchable worked wife post ipad era live food okay without anything special served apparently crew explained shortage staff afraid ba lot regain standing aviation world competition fierce sit laurels,0.0761002886002886,Positive
241,241,utterly appalling company flown two times times disaster first time return flight delayed 24 hours nobody gate tell us large group passengers roam round dubai airport looking ba staff none eventually another airline told us go unmarked stairs angry person told us fault given letter letter put us bus terminal arrived nobody greet us literally left yet contact another airline managed find us transport hotel got told full choose rooms given terrible dirty cramped room several times throughout night called tell us flight moved eventually got board next day tray table broken window blind get meal compensation offered second time need reschedule flight website assured fine provided link needed phone need phone ba even bother trying never got speak anyone ended booking hotel wait flight rather rescheduling food terrible meagre portions given infrequently sandwich inedible,-0.2074404761904762,Negative
242,242,past 2 years flown british airways twice ended exact predicament wait around day london heathrow 1 hour flight home newcastle holidays plane staff fantastic customer service staff heathrow useless first time february 2020 got stuck heathrow due storm ciara travelling home work airlines fault however handling situation staff airport joke 4 5 staff ran kiosk queue 100 unhappy travellers whilst could set mini kiosks unused gates get everyone quicker crowd control one point queuing 2 hours plus staff decided shut shop end 12 hour battle lucky enough get home last flight day sheer luck finally spoke someone november 2021 decided give ba second chance booked go new york since plane landed late lhr missed connecting flight could avoided staff heathrow assisted held plane short rushed customs manage make gate 5 minutes spare plane still terminal since taken luggage flight told go service desk refused let since moved later flight layover 10 hours got guest services 12 food voucher spend phone number thought complaints hold 20 minutes found complaints considering fact could avoidable assistance given food voucher 12 seemed really cheap days got home raised complaint expressing annoyed waited month response chasing find complaints staff working got response said wanted 20 25 back holiday got apology told staff heathrow better terms good compensation offered nothing,0.020612373737373735,Positive
243,243,return trip cape town durban club class highlighted inconsistency outbound trip december good respects whereas return trip disappointing check fine apart agent failing label one bags priority resulting long wait third bag lounge busy complaints went boarding gate check time indicated screen sign activity although screen still showing gate departure time shortly thereafter two ground staff appeared approached said flight delayed 1330 1410 gate changed lower level bus gates informational screens updated delayed time new gate checked flight radar app showed aircraft started durban flown cape town port elizabeth back cape town clear time hope time flight fact looking schedule turn around times always going late boarding eventually started 1400 departure 1430 60 minutes late drinks service started 30 minutes later followed lunch food good wine offering mediocre club standards price good wines south africa excuse serving poor wine lunch service quick crew disappeared behind curtain offering top drinks unless specifically requested overall disappointing flight lacklustre crew,0.021146245059288523,Positive
244,244,used british airways first time admit impressed service firstly want thank lady assisted weigh luggage flight 16 10 however due unforeseen circumstances arrived airport around 15 40 convinced going miss flight queue long stood minutes realized would miss flight went club check lady incredibly kind believe patience even though fault weighed luggage able board flight successfully aware airline gives free meals got sandwich drink option choose vegetarian chicken personally love free stuff ditching flysafair even though excellent service well near future unfortunately diversity first time flew 2018 admit never seen diversity amongst cabin crew staff however british airways different staff kind friendly well wonderful experience fly guys,0.29166666666666663,Positive
245,245,recently unfortunate privilege travelling british airways detroit bangalore back given long arduous journey multiple layovers decided spend extra get business class ticket quickly dissuaded misconception special spent extra money business class shoddy service rudeness insolence ground staff experienced nothing frustration insecurity throughout journeys trump stranded london missed connection spending close 3 hours get front counter rebook flight business class traveller bearing told stand one gigantic line wait turn special passengers escorted club world check asked lady told us continue standing would come back get us counter freed needless say never finally got turn extra help ground staff running around frenzy rebooked come back question big corporations lie accountability would spend hard earned money something gave nothing extra shame british airways complete disregard passengers stop lying update promises,-0.006001984126984126,Negative
246,246,flown ba many years today another poor experience witnessed airline decline sub par service understand tough two years airlines ba decline started pandemic truly plummeted enormous queues jfk ba check terminal 7 even priority lane standstill least half hour people started complaining miss flights terrible efficiency check counters times one member staff processing people whilst ba staff stood around phones chat one member staff stopped processing man desperately trying catch flight order start processing someone else jumped interior plane generally filthy crumbs bits food stains marks around seating area give single wet wipe used think hands see passengers wiping surrounding area good courteous members staff also awful members staff behave unprofessionally particular flight one cabin crew swearing colleague back plane apparently pulling weight poor used proud ba flyer feel like clinging airline status actually provide better service days,-0.09096749811035527,Negative
247,247,entertainment selection sub par minimal selections new releases new releases food left something desired two seats row earphone jack work plane either uncomfortably hot cold find medium temp overall basic generic airline,-0.019696969696969695,Negative
248,248,straightforward friendly baggage drop south lounge polite conversation used lounge indication busy nowhere sit considering even 1 5m distancing roam entire lounge lugging bags carpeted floor success gave 20 minutes decided try another lounge arrived everything actually right front us actually found somewhere sit 5 minutes looking around menu basic eggs hash browns breakfast cakes muffins ordered frittata hungry made way self serve coffee counter basic coffee straight away put flies hovering croissants fruit flight departing gate take train rub salt wound told dxb flight usually leaves gone lounge near looking individual cubicles honest top reason choosing business class gave heart however doors close till take asked artisan crisps biscuits menu took hour lunch came another almost hour asked could swap puddings crumble person said surely try clearly apologies even trying portions small plus saw quite fellow passengers sleeping lunch asked could finished chocolates lindor nothing special amenities toilets different expect amenity kit basic duvet seemed well used worth almost 4 times amount regular ticket naive trust claims world class standards,0.13720238095238094,Positive
249,249,arrival warsaw airport check zone one announced flight board guess ask random people go finally found check desks luggage drop check appalling took us 1 5 hours get bags checked half way queue whole process disorganised slow really last thing want looking 2 small impatient kids lady warsaw airport supposed direct passengers correct queue useless one check desk euro traveller club europe one bag drop one check flight left delayed pilots managed catch landed small delay crew plane nice attentive luckily air experience much better sort ground service warsaw airport,-0.022549019607843147,Negative
250,250,glasgow one check desk open huge queue business check took close hour bagdrop getting onto aircraft glasgow hello crew getting normally find ba cabin crew nice breakfast tired looking croissant used ba lounge terminal 3 keen new table service poor choice miniscule portions lounge staff nice directions arrival lhr coach transfer t5 t3 packed like sardines much social distancing flight lhr pisa delayed boarded sat aircraft another 2hrs 30 mins captain advised us tow truck push back eventually arrive baggage handlers load containers drinks anything offered waited food even worth mentioning far club europe goes worth extra cost priority baggage mine last onto belt pisa seats economy seats centre one blocked first officer summed arrived pisa sorry folks trip pretty poor show ba right return trip hogmanay left time never flight pisa left time pisa lounge nice enough food choice laughable board gave food miss heathrow back glasgow flight left time food antipasto sort declined cases last club europe really worth money economy cabin would thought ba would food onboard service since cabin,0.07260038811762949,Positive
251,251,two years unable fly second home south africa covid fantastic back board ba flight cpt club suite seats 1k 2k boot seats huge improvement old yin yang cw seats terms privacy ease access ife screen cabin still felt densely occupied seats uncomfortable lying flat storage mixed blessing three rather fussy little compartments rather decent sized drawer old cw meaning laptop would stored food onboard woeful although serving three courses time least mean dinner service dragged cabin crew went business dutifully little enthusiasm usual queues toilets flight uneventful landing less time cpt efficient arrangement checking forms immediately leaving airbridge queues immigration good back,0.011875000000000002,Positive
252,252,paid 1189 round trip flight london back premium economy bumped seat flight back told issued refund instead issued refund contact several different methods phone website twitter finally email told getting 229 16 back less half 589 paid upgrade instead refunded 14 58 emailed told getting 115 16 back emailed saying add original amount told getting simply replied final amount turns meant taking back initial refund 14 58 getting 115 16 total emailed asking changed amount yet respond called morning explaining politely calling hung,-0.009895833333333333,Negative
253,253,nice return flight ba add previous review really like ba organises boarding disembarking processes groups super comfortable 100 passengers jump sweat queue gate even a320 new cabin fresh feeling nice mood lighting row 1 enhanced legroom thus makes 1 hour hop comfortable amazing staff even attentive accommodating gold level passengers always coming asking help needed lovely humus beetroot quinoa salad food great wifi really competitive pricing think great also food alcohol offered buy online travel classes domestic t5 arrivals breeze,0.3814393939393939,Positive
254,254,overall lovely flight ba edinburgh christmas holidays lounge ok quite worn although staff food nice much better travelled last time although plane seemed old cabin felt fresh clean temperature perfectly adjusted liking around 22 23c funky lighting although seats economy pretty comfortable 1 hour hop much better air france together enhanced legroom row 1 wonderful gold card passengers ba automatically reserves row 1 club europe enhanced legroom think great touch crew especially purser phenomenal extremely friendly adaptive needs professional leaving pleasant flight aftertaste afternoon tea catering lovely short flight sandwiches scones tasty actually fan well presented however simpler meals board opinion tastier give feeling trust quick hop ba ticked marks comparison cdg lhr leg air france presented chic cold starter however looked bit complicated except duck terrine rather unappetising klm served super nice simple chicken caesar paper box one big drawback first wing experience t5 queue long decided go regular lines instead quite disappointing given much money regular flyers companies spend earn gold status nevertheless flight importantly crew completely negated drawback flight 200 one way 600 return incl transfer kirkwall pretty expensive however service seemed like worth money,0.21289682539682545,Positive
255,255,first one smoothest uk us flights taken boarding appalling families kids queue reason called families front decided board business premier classes first appreciate call families worse seats ever legroom appalling entertainment system basic support bluetooth headphones usb support devices movies although website says yes headphones input good useless crew nice sorry missed,-0.030000000000000006,Negative
256,256,flying covid always challenge ba verifly app worked perfectly line check seamless bags drop t5 seamless boarding done efficiently zones although older 777 refurbished everything new clean cabin crew credit airline smartly dressed friendly keen please offered two drinks lunch served drinks meal food acceptable given tasty sandwich landing obviously economy 8 hours flying arrived relaxed unstressed,0.27322029822029825,Positive
257,257,flew nashville via chicago first excellent check security lounge good food drink choices good first cabin 787 8 seats comfortable seat entertainment little clunky cabin service top banana food drinks choices tastes amazing aircraft special call stewart tim credit ba,0.4569642857142857,Positive
258,258,low expectations business class ba european routes flight even worse t5 mess 90 minute queue check bags tons people arriving late check guy seemed clueless turkey needs pcr etc ba lounge joke went got sushi restaurant mulled wine crowded lounge bad round boarding chaos left hour late a320 jammed full business class little legroom middle seat free might well fly low cost carrier seat inflight screen overhead screen although curtain closed economy people used forward bathroom crew sending back salvation pretty decent shepherds pie red wine otherwise would avoid flying ba next day flew aircraft type bahrain another carrier proper business class seat flight screen headphones good food drinks arabic coffee dates gracious service ba hang head shame,0.00850694444444445,Positive
259,259,used new club world first time delighted new configuration privacy afforded much better flight entertainment storage brilliant unfortunately lethargic crew ever meal served basically disappeared wines warm even forgot offer wife drink lunch also pair used socks storage cabinet heathrow nightmare often happens 5 minutes early rewarded 40 minute wait gate 2 5 hour wait luggage absolutely shocking covid times,0.18227272727272728,Positive
260,260,flight yesterday 18 12 2021 due take 1215 soon reaching gate first passengers called pre boarding gate staff said aircraft given permission land aberdeen due poor weather airport information kept telling passengers go gate hour half passengers learned flight cancelled via ba app join line customer service desk took two hours reach desk case reaching desk told automatically booked following mornings flight offered overnight hotel meet needs requested cancellation get bags back told cancel booking ba app could desk directed via gate collect bags meant go via uk border reach baggage belt waited bags 3 hours automatically stored bags following days flight ba staff rude dismissive customer complaints length time bags taking arrive like fault cancelling alternative flight offered next day,-0.08666666666666667,Negative
261,261,first time flown ba business class 777 aircraft hopefully last firstly check crew great friendly helpful manual check machine always much nicer complaints department food journey adequate choice starter desert 3 choices main course business class seating 2 4 2 alternate seats facing backwards centre seats either facing stranger aisle seat put screen claustrophobic bubble see see passengers slightly better wife would utterly awful shut space stranger nowhere put glass bottle water book glasses within easy reach unless keep table business class seats tuck bag seat front take landing nowhere put bag everything go overhead locker missing first 4 rows centre seats much storage space row 1 get climb legs leg rest person aisle seat row 2 travelling solo centre seats always case normally couple take aisle centre least climbing partner legs stranger 5ft 10 could manage wife 5ft 4 could get without disturbing passenger row behind reading light hopeless shine book light controlled handset work utterly awful design certainly make us avoid ba future possible,0.029716117216117208,Positive
262,262,claimed miles right trip beginning august took almost 4 months reply surprise reject request without providing reasons sent complaint per e mail still get reply 4 5 months still waiting answer furthermore many people wearing masks asked flight attendants allowing people wear masks said medical exceptions ordered drinks replied needed pick business class customer service,0.12142857142857143,Positive
263,263,british airways taking reservations cancelling flights without giving reasons plans needed cancelled flights ba nothing ease process offered absolutely explanation flight cancelled going travel ba may travel year,0.1,Positive
264,264,flight booked january 2022 send email beginning december informing flight changed second flight moved next day making layover 26 hours called told cancel kind answer mean still need fly going booking another airline closer day flying expensive big inconvenience even get apology cancel,0.08392857142857142,Positive
