,Unnamed: 0,reviews,polarity,tags
0,0,australia friday night went online book flight heathrow malpensa milan realise specifically searched flights malpensa offered options airports milan received itinerary email another airport milan itinerary email provide means contact changes advise 24 hour cooling period weekend unable reach office monday advised refund fees missed 24 hour cooling period apparently ticket issued uk needed contact cancelled ticket going way future avoid flying british airways,-0.1125,Negative
1,1,7 54 day travel whilst driving london heathrow received email advising flight cancelled offered alternative flight american airlines alternative accept must travel today flying la see family member end life american airlines desk downgrade cabin premium economy economy tried 3 times ba provide telephone number total useless help given wrong email address sending complains given email ba frequent flyer decades loyal customer find travelling 11 hours economy without even possibility refund let alone upgrade completely unacceptable happened company better treatment ryanair,0.003703703703703703,Positive
2,2,would happily fly personal emergency allowed reschedule flights free charge onboard service lhr ist frills jfk lhr impeccable good food lots movies cds ife open bar service entire flight friendly flight attendants always happy provide extra drink snack,0.3825,Positive
3,3,flew premium worth extra money bit extra room penny pinching means benefit one drink service 10 hour flight fizz offered take poor food boarding badly organised food left tables 30 min landing tea coffee offered small cups water passed around nothing premium new planes decorated terribly feels like dentist waiting room devoid personality joy fly option fly premium expensive seriously worth much economy days especially middle 4,0.022727272727272735,Positive
4,4,first morning flight cancelled moved afternoon flight understanding sometimes situations unavoidable however lost us one day experience cairo quite upset got onto plane squashed regular seats flights husband spasms stretch legs across lap attendants ask okay clearly struggling service came us food choice made told settle left correct thing home sent complaints responded 100 pound voucher group,0.16999999999999998,Positive
5,5,although bit uncomfortable flight economy flight attendants made flight best possibly could nice professional crew attentive looking customers,0.26666666666666666,Positive
6,6,boarding decently organised a380 still rather strange configuration club world neighbour sitting opposite position a380 nearly full rather poor amenity bag welcome drink ok rather long waiting aperitive made pantry meal ok great aside champagne european wines flight service friendly rather slow spontaneous refills drinks offered acceptable continental style breakfast extremely narrow restrooms without lotions similar acceptable experience nothing landing 50 minutes waiting luggage labelled priority,0.19322916666666665,Positive
7,7,boarding time departure time flight london heathrow ok a320 rather narrow seats business light meal caesars salad mousse sweet choice drinks nothing wrong short flight fa friendly landing time,0.13214285714285712,Positive
8,8,original flight cancelled 2 weeks actual flight although alternative flights available british airways affected trip planned feels like ba favour passengers rather paid deliver service,0.19375,Positive
9,9,delayed change poor communication british airways sells premium prices flight tickets delivers better low cost airline customer service impossible contact seems ba tries hard hide possible email communication address available,-0.06203703703703703,Negative
10,10,competent check staff saw problem left arm insisted could take exit seat moved row 30 middle seat empty hand board huge line toilets 45 min 2 30 min flight crew member realised one toilets closed crew put luggage announced could serve hot drinks flight bear service slow asking give us enough cups hot drinks card machine working fill credit card slip bottle water nutrigrain bar,0.09,Positive
11,11,check slow self check bag drop boarding ok flight totally full booked row 9 ok space overhead bins seat legroom ok cabin crew ok smiled gave bottle water pretzels flight ok landed 25 mins early waited 30 minutes stand ground crew bags came reasonably quickly ba still seems believe something special premium carrier reality reason flew ba got virtually free tickets flights cancelled last year ba carrier last choice,0.3100340136054422,Positive
12,12,review relates appalling experiences british airways 14th february 2023 due travel madrid british airways setting heard radio flight delays looked heathrow airport website saw flight cancelled result information website called british airways 26 minutes hold found speaking somebody call centre south africa person hard understand due heavy accent incompetent insisted flight cancelled made way heathrow sure enough flight indeed cancelled woman question audacity declare flight cancelled facilities airport rebook refused let 12 people join queue clearly marked assistance desk woman one colleagues gave card telephone number told one rather elderly gentleman go online rebook seat visually impaired found attitude ba employee appalling called number card employee gave long queue call centre person picked phone kept waiting 22 minutes declared flight cancelled airport must wrong flippant tone said informed flight indeed cancelled would go speak iberia customer services heathrow rebook took elderly gentleman iberia counter staff member rolled eyes disgust said nothing iberia returned ba time joined check line told check agent happened man question booked onto next available flight within matter minutes gave 30 voucher form compensation said could add frequent flyer number partner airline voucher proved useless afraid various shops predepature area refused accept although told could use clearing security none shops would accept aboard new flight service minimal tiny bottle water packet pretzels nothing else available full flight many people transferred cancelled flight ba cabin crew announced additional items small bottle water pretzels ordered via skyshop,-0.030176767676767677,Negative
13,13,first time flying ba pleasantly surprised islamabad via doha comfortable crew great friendly helpful second flight operated qatar airways doha islamabad return journey direct ba flight 46kg luggage allowance really generous stopped hassle connecting flights crew flight really nice let ba food really nice ife could content really huge issue,0.3477272727272727,Positive
14,14,lots cancellations delays one apologized edinburgh london feb 14th 2023 original flight cancelled rebooked one cancelled well third rebooked one supposed departure 12 50 several delays 2 24 wait 57 minutes luggage arrive,0.125,Positive
15,15,ba 242 6 2 23 boarding delayed due late arrival incoming flight communication ground staff excellent keep us informed flight services excellent crews friendly excellent service overall happy ba,0.46875,Positive
16,16,nly first flight 17 years also first time back england 17 years flew pmi lgw 21 01 2023 returned 29 01 2023 wizz air easyjet offered inconvenient flight times charged flights worth baggage british airways convenient best value option available offered ideal flight times 18 charge per flight baggage reasonable total cost flights 126 regular update information via email seamless online seat allocation check efficient staff check desks pmi lgw ensured long queues dealt quickly humanly possible immaculate aircraft comfortable leather seats adequate legroom 6 4 tall cabin crew polite friendly professional flight food drinks good quality reasonably priced enjoyed meat ploughman ipa beer 10 total flights flown 80 times last 50 years different airlines various propeller jet aircraft well one lgw lhr helicopter transfer flying totally different experience back day age budget airline nostalgia aside british airways best airline flown,0.21194444444444446,Positive
17,17,husband flying madrid 3rd february legal matter madrid 13 00 pm booked flight car ba holidays unfortunately chose parking never used got lost missed 6 00 flight madrid tried stay calm cold head went british airways get help first lady spoke asked done booking ba holidays know gave us number call told us anything else call number called number asking us call another number message opening hours 8 till 4 pm went back lady explained wait 8 told us could anything reach another staff lovely young lady called althea started look made several calls went check someone else office managed get someone send text message call got answered lovely lady line modified booking place us following flight 7 30 charge us car reservation flight back maintained made madrid without support lovely althea professionalism care us would make sweet caring time determined help sure went beyond role responsibilities,0.12352941176470589,Positive
18,18,organised boarding process really friendly crew quick drink snack great experience crew credit ba best crew europe,0.6270833333333333,Positive
19,19,outward journey ba245 london buenos aires club world 10 january 2023 experience poor beginning end although reserved seats 11f 12j another passenger occupying 11f crew made attempt address problem eventually persuaded passenger move occupy designated seat 11d boarded punctually offered drinks asked drink crew member said late blamed seating problem crew member began taking orders dinner write gave minutes safety briefing asked us repeat orders later hot flannels smelled musty felt old ragged one crew wondered aloud whether companion related soup cold told served flasks explanation excuse coffee weak tasted like instant granules companion initially served bread roll dinner breakfast menu stated selection rolls pastries choice companion given dried fruit pastry would chosen bread roll although previously asked offered supplied seat small bottles water ran return journey ba244 buenos aires london heathrow world traveller plus 26 january 2023 huge contrast warm welcome boarding crew professionalism throughout poor reflection club world service experience world traveller plus much better kinder weighed advantages flat bed considerable price difference worth paying catalogue errors inconveniences outlined,0.012878787878787884,Positive
20,20,check agent lhr helpful friendly flight crew seat comfortable good leg room however food poor barely better economy class poor quality limited selection wine flight entertainment selections limited far inferior ba used offer overall premium economy product disappointing poor value money,0.011011904761904797,Positive
21,21,disappointing book ba fly day return flight 6pm 28 1 23 cancelled replaced flight 9pm took 1 2 hour late meaning arrived gatwick well midnight onward transport connections pay 70 taxi home plus seats really snug 5 7 knees hitting seat front ba trading name customer service reliability deteriorated ryanair better aircraft take slots,0.12000000000000002,Positive
22,22,excellent service ground board first class product might leading edge service around entire experience well worth cost ticket concorde room heathrow well managed great place relax prior trip flight slightly delayed heathrow arrived schedule johannesburg,0.31190476190476196,Positive
23,23,good lounge cape town time departure drinks high quality sound dinner service breakfast reasonable arrival lounge good showers cold,0.26,Positive
24,24,really excellent journey lounge overcrowded late afternoon plenty edible food easy boarding new club world suites great compared last travelled year ago food drink back previous standards choice individual wines rather bland blends courses served individually cut glass china beef cheek really tasty surprisingly good soup crew excellent good choice movies breakfast good night sleep fruits etc first manage full english offered arrival time could want quite gulf standards overall ba seems eventually got business class back standard,0.256198347107438,Positive
25,25,flight one worst ever life wanted pamper bought business class looking forward new experience mention chaos changing gates several times things may happen surprised lack attention passengers flight delayed almost 3 hours even though staff offered vouchers idea get told 10 minutes use boarding already begun firstly see anyone voucher secondly even got able use finally got airport another waiting 30 minutes cross check meantime told due problems load food flight without food board food offered given everyone plane small bag nuts business class passenger offered drinks business class contained 3 small glasses juice received apology compensation company disgraceful cheap service expensive price,-0.05275974025974026,Negative
26,26,seems race bottom amongst airlines even check ba requires submission documents covid restrictions however form start submission process hopelessly broken clicking submit form hangs forever error message given tried three different browsers three different devices hang means check online select seat tried using chat bot 30 minutes clicking try thought donated enough time ba,-0.1,Negative
27,27,spanish born individual living england using british airways 3 decades multiple times year 12th january 2023 booked flight son go alicante however informed 17th january 2023 doctors unable fly due elbow operation result decided give ticket daughter calling customer service team british airways make change 18th january 2023 took enquiry call seemed speech delay call presented small bit difficulty however also struggled understand support staff member top delay requesting change name one tickets daughters name told within policy would need cancel ticket rebook encouraged divide booking son two different booking reference numbers accepted asked would like cancel booking insisted would need know total refund lucky ask check informed would roughly 9 00 total cost booking 394 64 comes 197 32 per passenger leaving refund total less 3 value purchase despite seat abandoned according ba policy entitled simple change name less 3 refund even buying ticket right back phone probably money worth week ago,0.04812925170068027,Positive
28,28,rather empty quiet flight tel aviv friendly cabin crew due emptiness flight entire row allowed work easily much space required unfortunately upon landing breaks overheated wait fire crew cool delayed us otherwise overall excellent flight ba part first time flown flight actually taken correct time,0.12083333333333333,Positive
29,29,easy check staff member polite helpful made specific point acknowledging loyalty ba security london fast galleries north fine showers good organised flight boarding plane fine good crew new club world product wife damaged storage area otherwise ok take good drinks food service well run slept well time arrival found new seat design harder sleep,0.35328282828282825,Positive
30,30,silver flyer booking flight ba dublin would thought could use lounge even though ba used air lingus flight travelled recently situation allowed kind gentleman desk even though said gold really accommodating big deal two ladies desk like empathy saying guy let word come ba booked flight made fly air lingus let use lounge silver flier,0.32,Positive
31,31,find ba incredibly tacky constantly looking ways get money customers travelled using major airlines whole life although know sounds silly 4 hour flight major airline expect form beverage snack curtesy port charge phone pay insane prices luggage inflight entertainment aircraft snug challenged pay drink inflight entertainment told short haul fight sisters met cairo hour half flight flew egyptair somehow received luggage allowance drinks food inflight entertainment well usb port charge phones ba realise stands budget airline staff great got money much,0.05075757575757578,Positive
32,32,flew atl lhr 8th jan 2023 unlucky enough board 23 year old 777 refit gave decent ife screen seat looked decent although combine ife cheap nasty earbuds movie ruined headrest great pity little padding used seat wife uncomfortable leg room general poor especially passengers keep seat reclined start finish zero room aircraft tired rubber spacers falling silicone sealer falling apart toilets toilet seats old stained rubber arm rest hanging post take drinks snacks offered meal sent couple hours poor chicken cubes reminded dog food mashed potatoes purified within inch life stale rock hard roll salad rice carrots dried crackers cheese kids meal sad tiny leaf salad enough dressing refloat shipwreck coffee creamer given kids meal snack decent adults bagel cheese egg hot tasty kids snack green wrap spinach onions poor mix food ba service grunt crammed seat 7 hours landing remote stand enduring bus terminal ba opinion terrible flight disappointing one great member cabin crew everything else average,-0.13825757575757577,Negative
33,33,great thing british airways a380 economy section upstairs get allows small stowage cupboards window seats despite old a380 looked tired inside broken side stowage seat reclined uncontrollably slow react ife food supposed christmas dinner 3 wafer thin bits dry turkey 4 cooked sprouts cubed potatoes poor taste quality mousse desert great though slight issue snack meal ordered childs option marked regular meal arrived well exactly asked crew member told difference sticker box staff ok couple decent mostly ok overall ba seems tad cheap days great sit upstairs enjoyment ended seemed bit dull like ba average airline,0.06920289855072463,Positive
34,34,staff friendly plane cold shivering gave light blankets enough meals basic entertainment basic luggage delayed today day 6 ba staff phone say call 72 hours tracking system vague extract information staff arrived vancouver jan 2nd offered collect baggage vague answer call airport asked ba phone number yvr said phone number call call main airport policy states make claim 21 days,-0.06583333333333333,Negative
35,35,probably worst business class experience ever airline issues required purchase seats international club world business class made known ticket purchase process cost additional 600 single leg lhr lax family four given strange business class seating layout ba a380s leaving seat selection change could disastrous family ridiculously long boarding times even small aircraft vie lhr leg boarding time a320 50 minutes long leading delayed departure urgency part staff speed boarding times severe overcrowding boarding area satellite c terminal 5 heathrow boarding staff would allow passengers enter roped queue area boarding idea crowding extreme overall boarding area far small a380 believe satellite designed built first a380s delivered online check advance flights appears completely broken urged repeatedly ba website via email text upload covid documents even though end 2022 covid documents required travel filled basic contact information website upload covid documentation informed several hours later covid documents verified received another text message urging upload covid documentation vie lhr leg shop ba com page one directed attempting connect wifi plane indicated ridiculously incorrect remaining flight times six hours four hours landing ba lounges club europe club world heathrow often seriously overcrowded furniture carpeting finishes clubs worn dirty said food lounges pretty good quality food quality ba lounges heathrow may redeeming thing airline onboard food beverage service far average international business class terrible one might say lhr lax leg pre meal beverage service mid flight beverage services unlike business class offerings airlines taking meal order flight attendants beginning flight meals brought haphazardly shortly take chicken fish type meal selection similar economy class coffee tea service meals food quality poor pre landing snack ploughman lunch downright disgusting beverage bar set galley areas beverages available passengers flight standard international business class offerings even bottles water seemed hidden away requiring one ask flight attendants water comment bizarre seating layout a380 others rightly panned awkwardness extremely poor design seating seats 6 2 long stated ba website found seats short 6 2 height priority luggage tags followed baggage delivery,-0.10683831672203765,Negative
36,36,definitely recommended especially business class seats ridiculous small food mediocre good luck internet even pay full internet entire flight service however great attendant saved crying know designed aircraft expensive business class order move middle seat go bathroom must rudely climb person legs sitting aisle seat seat like enclosed tiny cubicle storage space unfortunately traveled british airways business class least 4 times within last 4 months never unless choice way business class lounge south heathrow cattle pen,-0.043859649122807015,Negative
37,37,ba shuttle service across uk still surprisingly good product compared ba long haul always get best comments times reasonable priced works well fresh crews queues long distances walk know still offer covid style bottle water snack stretching cup tea snack would great add service currently line sky cafe fiddly work get connected short trips,0.32222222222222224,Positive
38,38,must admit like many others tend avoid ba long haul possible due many poor reviews first ride ba a380 day exception say aircraft immaculate economy seat really comfortable ife work interesting anyway got map screenshot lunch poor quality plenty nice white wine alcoholic drinks made cabin crew pleasant poor grooming lets skirts trouser suits long sleeves short jackets waistcoat cardigans time could done better think baggage delivery really quick summing well still coming back ba yet maybe old charm return soon,0.1305555555555556,Positive
39,39,ba update business class cabin 8 across 777 much travelling facing backwards cabin staff pass food trays across front passengers paying business class fares pay reserve specific seat antiquated idea cabin staff fine food acceptable check ok business lounge breakfast acceptable lack space seating area small screen disfunctional entertainment equipment disappointing step reclining passengers feet attractive,0.15238095238095242,Positive
40,40,paid 200 day flight upgrade economy premium economy checkin could find booking little wait rang someone explains upgrade get deleted system checkin agent sees took 5 minutes resolve seat nice enough stowage pocket front bit small food reasonably nice shame bathroom way back economy bit queue ife system good selection mediocre worst part flight cpt remote stand bussed passport control quickly took absolute age get luggage ruined would otherwise reasonable flight upgrade worth 200 maybe 300 long flight offers 2000 whatever premium economy comedy pricing score luggage fiasco would 7 8 10 luggage fiasco rate 4 10,0.059114583333333325,Positive
41,41,ba website work weirdly deleted flight upcoming flights day departure chaos cape town airport hundreds queuing computers chaos gate queue management premium passengers nice new a350 smart new club suite champagne warm cabin crew said impossible serve cold true air france manage disappointing meal wine served late food finished time arrives cheese ice cold tasteless champagne white wine fridge used cheese good ife system mediocre film selection disappointing breakfast overall 3 10 flew air france business month way better sad become ba,-0.11148268398268397,Negative
42,42,absolutely terrible experience british airways short flight london heathrow frankfurt get suitcase time next flight cathay pacific melbourne despite 3 hour gap two flights told would arrange suitcase transferred directly melbourne instead got hong kong left finally tracked sent back london happened christmas stressful yet minimal communication team plane crew may lovely service outside nothing short dreadful given option avoid flying future,-0.10714285714285714,Negative
